/home/hu/hu_hu/hu_elnaab01/.conda/envs/bachelor_analysis/bin/python
Python 3.10.19
========================================
   PHASE 2: THE STATISTICAL ARENA       
   (Prophet / TBATS / SARIMAX)          
========================================

>>> ENTERING ARENA: PROPHET <<<

   [Experiment] with_wsi_solar ...
   [Tuning] Running 30 trials...
  0%|          | 0/30 [00:00<?, ?trial/s, best loss=?]  3%|▎         | 1/30 [00:01<00:35,  1.22s/trial, best loss: 3573.8285214043603]  7%|▋         | 2/30 [00:02<00:29,  1.05s/trial, best loss: 3573.8285214043603] 10%|█         | 3/30 [00:02<00:25,  1.06trial/s, best loss: 3573.8285214043603] 13%|█▎        | 4/30 [00:04<00:29,  1.14s/trial, best loss: 2427.5934331744234] 17%|█▋        | 5/30 [00:05<00:25,  1.02s/trial, best loss: 2427.5934331744234] 20%|██        | 6/30 [00:06<00:26,  1.12s/trial, best loss: 2427.5934331744234] 23%|██▎       | 7/30 [00:07<00:23,  1.04s/trial, best loss: 2427.5934331744234] 27%|██▋       | 8/30 [00:08<00:22,  1.03s/trial, best loss: 2427.5934331744234] 30%|███       | 9/30 [00:10<00:28,  1.35s/trial, best loss: 2427.5934331744234] 33%|███▎      | 10/30 [00:11<00:24,  1.25s/trial, best loss: 2427.5934331744234] 37%|███▋      | 11/30 [00:12<00:20,  1.09s/trial, best loss: 2427.5934331744234] 40%|████      | 12/30 [00:13<00:19,  1.07s/trial, best loss: 2427.5934331744234] 43%|████▎     | 13/30 [00:14<00:18,  1.09s/trial, best loss: 2427.5934331744234] 47%|████▋     | 14/30 [00:16<00:23,  1.48s/trial, best loss: 2427.5934331744234] 50%|█████     | 15/30 [00:17<00:20,  1.37s/trial, best loss: 2427.5934331744234] 53%|█████▎    | 16/30 [00:18<00:16,  1.19s/trial, best loss: 2427.5934331744234] 57%|█████▋    | 17/30 [00:19<00:15,  1.19s/trial, best loss: 2427.5934331744234] 60%|██████    | 18/30 [00:21<00:14,  1.24s/trial, best loss: 2427.5934331744234] 63%|██████▎   | 19/30 [00:22<00:12,  1.12s/trial, best loss: 2427.5934331744234] 67%|██████▋   | 20/30 [00:23<00:11,  1.17s/trial, best loss: 2427.5934331744234] 70%|███████   | 21/30 [00:25<00:13,  1.50s/trial, best loss: 2427.5934331744234] 73%|███████▎  | 22/30 [00:26<00:11,  1.40s/trial, best loss: 2427.5934331744234] 77%|███████▋  | 23/30 [00:27<00:09,  1.33s/trial, best loss: 2427.5934331744234] 80%|████████  | 24/30 [00:29<00:08,  1.46s/trial, best loss: 2427.5934331744234] 83%|████████▎ | 25/30 [00:31<00:07,  1.57s/trial, best loss: 2427.5934331744234] 87%|████████▋ | 26/30 [00:32<00:06,  1.52s/trial, best loss: 2426.436398599516]  90%|█████████ | 27/30 [00:34<00:04,  1.55s/trial, best loss: 2424.246336131068] 93%|█████████▎| 28/30 [00:36<00:03,  1.79s/trial, best loss: 2424.246336131068] 97%|█████████▋| 29/30 [00:38<00:01,  1.79s/trial, best loss: 2424.246336131068]100%|██████████| 30/30 [00:40<00:00,  1.92s/trial, best loss: 2424.246336131068]100%|██████████| 30/30 [00:40<00:00,  1.36s/trial, best loss: 2424.246336131068]
   [Training] Final Run with Champion Parameters...
   [Result] RMSE: 2424.25
   [REPORT] Saved to outputs/results_prophet.txt

   [Experiment] no_wsi_solar ...
   [Tuning] Running 30 trials...
  0%|          | 0/30 [00:00<?, ?trial/s, best loss=?]  3%|▎         | 1/30 [00:01<00:33,  1.14s/trial, best loss: 2453.7706535300517]  7%|▋         | 2/30 [00:01<00:26,  1.06trial/s, best loss: 2453.7706535300517] 10%|█         | 3/30 [00:03<00:30,  1.13s/trial, best loss: 2453.7706535300517] 13%|█▎        | 4/30 [00:04<00:29,  1.14s/trial, best loss: 2453.7706535300517] 17%|█▋        | 5/30 [00:06<00:33,  1.35s/trial, best loss: 2453.7706535300517] 20%|██        | 6/30 [00:07<00:31,  1.33s/trial, best loss: 2453.7706535300517] 23%|██▎       | 7/30 [00:09<00:37,  1.63s/trial, best loss: 2453.7706535300517] 27%|██▋       | 8/30 [00:10<00:31,  1.43s/trial, best loss: 2453.7706535300517] 30%|███       | 9/30 [00:11<00:27,  1.31s/trial, best loss: 2453.7706535300517] 33%|███▎      | 10/30 [00:13<00:26,  1.32s/trial, best loss: 2453.7706535300517] 37%|███▋      | 11/30 [00:13<00:21,  1.14s/trial, best loss: 2453.7706535300517] 40%|████      | 12/30 [00:14<00:18,  1.05s/trial, best loss: 2453.7706535300517] 43%|████▎     | 13/30 [00:15<00:17,  1.01s/trial, best loss: 2453.7706535300517] 47%|████▋     | 14/30 [00:16<00:14,  1.07trial/s, best loss: 2453.7706535300517] 50%|█████     | 15/30 [00:17<00:13,  1.15trial/s, best loss: 2453.7706535300517] 53%|█████▎    | 16/30 [00:18<00:12,  1.11trial/s, best loss: 2453.7706535300517] 57%|█████▋    | 17/30 [00:19<00:12,  1.08trial/s, best loss: 2453.7706535300517] 60%|██████    | 18/30 [00:20<00:14,  1.23s/trial, best loss: 2445.4409788142134] 63%|██████▎   | 19/30 [00:22<00:13,  1.24s/trial, best loss: 2445.4409788142134] 67%|██████▋   | 20/30 [00:23<00:12,  1.29s/trial, best loss: 2445.4409788142134] 70%|███████   | 21/30 [00:25<00:13,  1.48s/trial, best loss: 2445.4409788142134] 73%|███████▎  | 22/30 [00:27<00:11,  1.47s/trial, best loss: 2442.9114853089786] 77%|███████▋  | 23/30 [00:28<00:10,  1.51s/trial, best loss: 2442.9114853089786] 80%|████████  | 24/30 [00:30<00:09,  1.64s/trial, best loss: 2442.9114853089786] 83%|████████▎ | 25/30 [00:32<00:08,  1.63s/trial, best loss: 2442.9114853089786] 87%|████████▋ | 26/30 [00:34<00:07,  1.78s/trial, best loss: 2442.9114853089786] 90%|█████████ | 27/30 [00:35<00:05,  1.73s/trial, best loss: 2442.9114853089786] 93%|█████████▎| 28/30 [00:37<00:03,  1.73s/trial, best loss: 2442.9114853089786] 97%|█████████▋| 29/30 [00:39<00:01,  1.72s/trial, best loss: 2442.9114853089786]100%|██████████| 30/30 [00:41<00:00,  1.73s/trial, best loss: 2442.9114853089786]100%|██████████| 30/30 [00:41<00:00,  1.37s/trial, best loss: 2442.9114853089786]
   [Training] Final Run with Champion Parameters...
   [Result] RMSE: 2442.91
   [REPORT] Saved to outputs/results_prophet.txt

   [Experiment] with_wsi_wind ...
   [Tuning] Running 30 trials...
  0%|          | 0/30 [00:00<?, ?trial/s, best loss=?]  3%|▎         | 1/30 [00:01<00:32,  1.11s/trial, best loss: 5126.31182179431]  7%|▋         | 2/30 [00:03<00:47,  1.71s/trial, best loss: 5126.31182179431] 10%|█         | 3/30 [00:04<00:38,  1.42s/trial, best loss: 5120.838309155802] 13%|█▎        | 4/30 [00:05<00:35,  1.38s/trial, best loss: 5120.838309155802] 17%|█▋        | 5/30 [00:07<00:43,  1.73s/trial, best loss: 5120.838309155802] 20%|██        | 6/30 [00:08<00:34,  1.45s/trial, best loss: 5120.838309155802] 23%|██▎       | 7/30 [00:09<00:30,  1.33s/trial, best loss: 5120.838309155802] 27%|██▋       | 8/30 [00:12<00:39,  1.78s/trial, best loss: 5120.838309155802] 30%|███       | 9/30 [00:13<00:31,  1.51s/trial, best loss: 5120.838309155802] 33%|███▎      | 10/30 [00:17<00:42,  2.11s/trial, best loss: 5104.269745029554] 37%|███▋      | 11/30 [00:18<00:33,  1.77s/trial, best loss: 5104.269745029554] 40%|████      | 12/30 [00:19<00:28,  1.57s/trial, best loss: 5104.269745029554] 43%|████▎     | 13/30 [00:20<00:23,  1.38s/trial, best loss: 5104.269745029554] 47%|████▋     | 14/30 [00:21<00:20,  1.29s/trial, best loss: 5104.269745029554] 50%|█████     | 15/30 [00:23<00:21,  1.44s/trial, best loss: 5104.269745029554] 53%|█████▎    | 16/30 [00:24<00:21,  1.54s/trial, best loss: 5104.269745029554] 57%|█████▋    | 17/30 [00:26<00:20,  1.55s/trial, best loss: 5104.269745029554] 60%|██████    | 18/30 [00:27<00:15,  1.33s/trial, best loss: 5068.193323693208] 63%|██████▎   | 19/30 [00:28<00:13,  1.25s/trial, best loss: 5068.193323693208] 67%|██████▋   | 20/30 [00:31<00:17,  1.72s/trial, best loss: 5068.193323693208] 70%|███████   | 21/30 [00:31<00:13,  1.46s/trial, best loss: 5068.193323693208] 73%|███████▎  | 22/30 [00:32<00:09,  1.24s/trial, best loss: 5033.464078763663] 77%|███████▋  | 23/30 [00:33<00:07,  1.10s/trial, best loss: 5033.464078763663] 80%|████████  | 24/30 [00:34<00:05,  1.01trial/s, best loss: 5033.464078763663] 83%|████████▎ | 25/30 [00:34<00:04,  1.10trial/s, best loss: 5011.324243090805] 87%|████████▋ | 26/30 [00:35<00:03,  1.10trial/s, best loss: 5011.324243090805] 90%|█████████ | 27/30 [00:36<00:02,  1.13trial/s, best loss: 5011.324243090805] 93%|█████████▎| 28/30 [00:37<00:01,  1.13trial/s, best loss: 5011.324243090805] 97%|█████████▋| 29/30 [00:38<00:00,  1.13trial/s, best loss: 5011.324243090805]100%|██████████| 30/30 [00:39<00:00,  1.20trial/s, best loss: 5011.324243090805]100%|██████████| 30/30 [00:39<00:00,  1.30s/trial, best loss: 5011.324243090805]
   [Training] Final Run with Champion Parameters...
   [Result] RMSE: 5011.32
   [REPORT] Saved to outputs/results_prophet.txt

   [Experiment] no_wsi_wind ...
   [Tuning] Running 30 trials...
  0%|          | 0/30 [00:00<?, ?trial/s, best loss=?]  3%|▎         | 1/30 [00:00<00:25,  1.12trial/s, best loss: 5612.278980541509]  7%|▋         | 2/30 [00:01<00:27,  1.03trial/s, best loss: 5612.278980541509] 10%|█         | 3/30 [00:03<00:28,  1.07s/trial, best loss: 5612.278980541509] 13%|█▎        | 4/30 [00:03<00:24,  1.04trial/s, best loss: 5414.819669980551] 17%|█▋        | 5/30 [00:04<00:24,  1.02trial/s, best loss: 5414.819669980551] 20%|██        | 6/30 [00:06<00:24,  1.02s/trial, best loss: 5280.370410988978] 23%|██▎       | 7/30 [00:07<00:27,  1.20s/trial, best loss: 5280.370410988978] 27%|██▋       | 8/30 [00:08<00:23,  1.08s/trial, best loss: 5280.370410988978] 30%|███       | 9/30 [00:10<00:29,  1.41s/trial, best loss: 5280.370410988978] 33%|███▎      | 10/30 [00:11<00:24,  1.23s/trial, best loss: 5280.370410988978] 37%|███▋      | 11/30 [00:15<00:37,  1.99s/trial, best loss: 5218.23885826171]  40%|████      | 12/30 [00:16<00:35,  1.95s/trial, best loss: 5218.23885826171] 43%|████▎     | 13/30 [00:17<00:27,  1.64s/trial, best loss: 5218.23885826171] 47%|████▋     | 14/30 [00:20<00:30,  1.91s/trial, best loss: 5218.23885826171] 50%|█████     | 15/30 [00:23<00:32,  2.18s/trial, best loss: 5218.23885826171] 53%|█████▎    | 16/30 [00:25<00:32,  2.31s/trial, best loss: 5218.23885826171] 57%|█████▋    | 17/30 [00:27<00:25,  1.99s/trial, best loss: 5205.293794093945] 60%|██████    | 18/30 [00:27<00:19,  1.63s/trial, best loss: 5205.293794093945] 63%|██████▎   | 19/30 [00:28<00:15,  1.42s/trial, best loss: 5205.293794093945] 67%|██████▋   | 20/30 [00:30<00:14,  1.41s/trial, best loss: 5205.293794093945] 70%|███████   | 21/30 [00:30<00:11,  1.23s/trial, best loss: 5205.293794093945] 73%|███████▎  | 22/30 [00:32<00:10,  1.31s/trial, best loss: 5205.293794093945] 77%|███████▋  | 23/30 [00:33<00:08,  1.18s/trial, best loss: 5205.293794093945] 80%|████████  | 24/30 [00:34<00:06,  1.09s/trial, best loss: 5197.786850940361] 83%|████████▎ | 25/30 [00:35<00:05,  1.08s/trial, best loss: 5197.786850940361] 87%|████████▋ | 26/30 [00:36<00:04,  1.01s/trial, best loss: 5197.786850940361] 90%|█████████ | 27/30 [00:37<00:02,  1.02trial/s, best loss: 5197.786850940361] 93%|█████████▎| 28/30 [00:37<00:01,  1.05trial/s, best loss: 5197.786850940361] 97%|█████████▋| 29/30 [00:38<00:00,  1.12trial/s, best loss: 5197.786850940361]100%|██████████| 30/30 [00:39<00:00,  1.13trial/s, best loss: 5197.786850940361]100%|██████████| 30/30 [00:39<00:00,  1.32s/trial, best loss: 5197.786850940361]
   [Training] Final Run with Champion Parameters...
   [Result] RMSE: 5197.79
   [REPORT] Saved to outputs/results_prophet.txt

>>> ENTERING ARENA: TBATS <<<

   [Experiment] with_wsi_solar ...
   [Tuning] Running 30 trials...
  0%|          | 0/30 [00:00<?, ?trial/s, best loss=?]  3%|▎         | 1/30 [07:30<3:37:32, 450.09s/trial, best loss: 137360422364.13759]