/home/hu/hu_hu/hu_elnaab01/.conda/envs/bachelor_analysis/bin/python
Python 3.10.19
================================================================================
   LEAR ONLY (WITH DETAILED TRACKING)
================================================================================

>>> EXPERIMENT: WITH_WSI_SOLAR <<<
   [Tuning] Running 20 trials...
  0%|          | 0/20 [00:00<?, ?trial/s, best loss=?]  5%|▌         | 1/20 [00:00<00:07,  2.59trial/s, best loss: 415.3683275045837] 10%|█         | 2/20 [00:00<00:06,  2.77trial/s, best loss: 415.3683275045837] 15%|█▌        | 3/20 [00:01<00:07,  2.33trial/s, best loss: 368.2035172421815] 20%|██        | 4/20 [00:01<00:06,  2.62trial/s, best loss: 368.2035172421815] 25%|██▌       | 5/20 [00:02<00:06,  2.33trial/s, best loss: 361.50094033566506] 30%|███       | 6/20 [00:02<00:06,  2.19trial/s, best loss: 361.50094033566506] 35%|███▌      | 7/20 [00:03<00:06,  2.11trial/s, best loss: 361.50094033566506] 40%|████      | 8/20 [00:03<00:05,  2.08trial/s, best loss: 361.50094033566506] 45%|████▌     | 9/20 [00:03<00:04,  2.28trial/s, best loss: 361.50094033566506] 50%|█████     | 10/20 [00:04<00:03,  2.51trial/s, best loss: 361.50094033566506] 55%|█████▌    | 11/20 [00:04<00:03,  2.61trial/s, best loss: 361.50094033566506] 60%|██████    | 12/20 [00:05<00:03,  2.44trial/s, best loss: 361.50094033566506] 65%|██████▌   | 13/20 [00:06<00:04,  1.49trial/s, best loss: 326.2729951408488]  70%|███████   | 14/20 [00:07<00:05,  1.15trial/s, best loss: 319.1424595116692] 75%|███████▌  | 15/20 [00:07<00:03,  1.42trial/s, best loss: 319.1424595116692] 80%|████████  | 16/20 [00:09<00:03,  1.14trial/s, best loss: 319.1424595116692] 85%|████████▌ | 17/20 [00:09<00:02,  1.40trial/s, best loss: 319.1424595116692] 90%|█████████ | 18/20 [00:10<00:01,  1.14trial/s, best loss: 319.1424595116692] 95%|█████████▌| 19/20 [00:12<00:00,  1.02trial/s, best loss: 319.1424595116692]100%|██████████| 20/20 [00:13<00:00,  1.07s/trial, best loss: 319.1424595116692]100%|██████████| 20/20 [00:13<00:00,  1.50trial/s, best loss: 319.1424595116692]
   [Training] Final Run...
   [Result] RMSE: 319.14 | MAE: 198.44
   [REPORT] Saved to ../outputs/results_lear.txt
   [DETAILED] Saved 1589 predictions to detailed_results/lear_with_wsi_solar.csv
   [DETAILED] Appended to master file: detailed_results/all_predictions.csv

>>> EXPERIMENT: NO_WSI_SOLAR <<<
   [Tuning] Running 20 trials...
  0%|          | 0/20 [00:00<?, ?trial/s, best loss=?]  5%|▌         | 1/20 [00:00<00:05,  3.51trial/s, best loss: 421.7760492133671] 10%|█         | 2/20 [00:00<00:06,  2.62trial/s, best loss: 370.9512482381834] 15%|█▌        | 3/20 [00:01<00:05,  2.97trial/s, best loss: 370.9512482381834] 20%|██        | 4/20 [00:01<00:05,  3.16trial/s, best loss: 370.9512482381834] 25%|██▌       | 5/20 [00:02<00:10,  1.47trial/s, best loss: 321.62887066310174] 30%|███       | 6/20 [00:02<00:07,  1.83trial/s, best loss: 321.62887066310174] 35%|███▌      | 7/20 [00:03<00:06,  1.92trial/s, best loss: 321.62887066310174] 40%|████      | 8/20 [00:04<00:09,  1.33trial/s, best loss: 321.62887066310174] 45%|████▌     | 9/20 [00:05<00:09,  1.11trial/s, best loss: 321.62887066310174] 50%|█████     | 10/20 [00:07<00:10,  1.04s/trial, best loss: 321.62887066310174] 55%|█████▌    | 11/20 [00:07<00:07,  1.15trial/s, best loss: 321.62887066310174] 60%|██████    | 12/20 [00:08<00:07,  1.02trial/s, best loss: 321.62887066310174] 65%|██████▌   | 13/20 [00:09<00:05,  1.21trial/s, best loss: 321.62887066310174] 70%|███████   | 14/20 [00:09<00:04,  1.48trial/s, best loss: 321.62887066310174] 75%|███████▌  | 15/20 [00:10<00:03,  1.62trial/s, best loss: 321.62887066310174] 80%|████████  | 16/20 [00:11<00:03,  1.20trial/s, best loss: 321.62887066310174] 85%|████████▌ | 17/20 [00:12<00:02,  1.02trial/s, best loss: 321.62887066310174] 90%|█████████ | 18/20 [00:13<00:01,  1.21trial/s, best loss: 321.62887066310174] 95%|█████████▌| 19/20 [00:14<00:00,  1.05trial/s, best loss: 321.62887066310174]100%|██████████| 20/20 [00:15<00:00,  1.07s/trial, best loss: 321.62887066310174]100%|██████████| 20/20 [00:15<00:00,  1.26trial/s, best loss: 321.62887066310174]
   [Training] Final Run...
   [Result] RMSE: 321.63 | MAE: 204.18
   [REPORT] Saved to ../outputs/results_lear.txt
   [DETAILED] Saved 1589 predictions to detailed_results/lear_no_wsi_solar.csv
   [DETAILED] Appended to master file: detailed_results/all_predictions.csv

>>> EXPERIMENT: WITH_WSI_WIND <<<
   [Tuning] Running 20 trials...
  0%|          | 0/20 [00:00<?, ?trial/s, best loss=?]  5%|▌         | 1/20 [00:00<00:06,  2.73trial/s, best loss: 767.8676630407865] 10%|█         | 2/20 [00:01<00:17,  1.05trial/s, best loss: 745.3570546648511] 15%|█▌        | 3/20 [00:03<00:19,  1.14s/trial, best loss: 745.3570546648511] 20%|██        | 4/20 [00:03<00:14,  1.12trial/s, best loss: 745.3570546648511] 25%|██▌       | 5/20 [00:04<00:11,  1.33trial/s, best loss: 745.3570546648511] 30%|███       | 6/20 [00:04<00:08,  1.61trial/s, best loss: 745.3570546648511] 35%|███▌      | 7/20 [00:04<00:06,  1.87trial/s, best loss: 745.3570546648511] 40%|████      | 8/20 [00:06<00:09,  1.25trial/s, best loss: 742.7099059815426] 45%|████▌     | 9/20 [00:07<00:10,  1.03trial/s, best loss: 742.7099059815426] 50%|█████     | 10/20 [00:08<00:08,  1.20trial/s, best loss: 742.7099059815426] 55%|█████▌    | 11/20 [00:08<00:06,  1.45trial/s, best loss: 742.7099059815426] 60%|██████    | 12/20 [00:09<00:07,  1.12trial/s, best loss: 742.7099059815426] 65%|██████▌   | 13/20 [00:10<00:05,  1.36trial/s, best loss: 742.7099059815426] 70%|███████   | 14/20 [00:10<00:03,  1.61trial/s, best loss: 742.7099059815426] 75%|███████▌  | 15/20 [00:11<00:04,  1.19trial/s, best loss: 742.7099059815426] 80%|████████  | 16/20 [00:12<00:02,  1.44trial/s, best loss: 742.7099059815426] 85%|████████▌ | 17/20 [00:13<00:02,  1.12trial/s, best loss: 742.7099059815426] 90%|█████████ | 18/20 [00:13<00:01,  1.36trial/s, best loss: 742.7099059815426] 95%|█████████▌| 19/20 [00:14<00:00,  1.49trial/s, best loss: 742.7099059815426]100%|██████████| 20/20 [00:14<00:00,  1.60trial/s, best loss: 742.7099059815426]100%|██████████| 20/20 [00:14<00:00,  1.33trial/s, best loss: 742.7099059815426]
   [Training] Final Run...
   [Result] RMSE: 742.71 | MAE: 533.90
   [REPORT] Saved to ../outputs/results_lear.txt
   [DETAILED] Saved 1589 predictions to detailed_results/lear_with_wsi_wind.csv
   [DETAILED] Appended to master file: detailed_results/all_predictions.csv

>>> EXPERIMENT: NO_WSI_WIND <<<
   [Tuning] Running 20 trials...
  0%|          | 0/20 [00:00<?, ?trial/s, best loss=?]  5%|▌         | 1/20 [00:01<00:26,  1.41s/trial, best loss: 750.0990802941279] 10%|█         | 2/20 [00:01<00:14,  1.28trial/s, best loss: 750.0990802941279] 15%|█▌        | 3/20 [00:02<00:09,  1.74trial/s, best loss: 750.0990802941279] 20%|██        | 4/20 [00:02<00:08,  1.80trial/s, best loss: 750.0990802941279] 25%|██▌       | 5/20 [00:04<00:12,  1.16trial/s, best loss: 750.0990802941279] 30%|███       | 6/20 [00:04<00:10,  1.34trial/s, best loss: 750.0990802941279] 35%|███▌      | 7/20 [00:05<00:12,  1.03trial/s, best loss: 750.0990802941279] 40%|████      | 8/20 [00:06<00:09,  1.21trial/s, best loss: 750.0990802941279] 45%|████▌     | 9/20 [00:06<00:07,  1.48trial/s, best loss: 750.0990802941279] 50%|█████     | 10/20 [00:08<00:09,  1.10trial/s, best loss: 744.0291534928069] 55%|█████▌    | 11/20 [00:08<00:07,  1.27trial/s, best loss: 744.0291534928069] 60%|██████    | 12/20 [00:10<00:07,  1.02trial/s, best loss: 744.0291534928069] 65%|██████▌   | 13/20 [00:11<00:07,  1.12s/trial, best loss: 744.0291534928069] 70%|███████   | 14/20 [00:11<00:05,  1.14trial/s, best loss: 744.0291534928069] 75%|███████▌  | 15/20 [00:13<00:05,  1.04s/trial, best loss: 744.0291534928069] 80%|████████  | 16/20 [00:13<00:03,  1.21trial/s, best loss: 744.0291534928069] 85%|████████▌ | 17/20 [00:14<00:02,  1.47trial/s, best loss: 744.0291534928069] 90%|█████████ | 18/20 [00:14<00:01,  1.74trial/s, best loss: 744.0291534928069] 95%|█████████▌| 19/20 [00:15<00:00,  1.20trial/s, best loss: 744.0291534928069]100%|██████████| 20/20 [00:16<00:00,  1.47trial/s, best loss: 744.0291534928069]100%|██████████| 20/20 [00:16<00:00,  1.24trial/s, best loss: 744.0291534928069]
   [Training] Final Run...
   [Result] RMSE: 744.03 | MAE: 538.39
   [REPORT] Saved to ../outputs/results_lear.txt
   [DETAILED] Saved 1589 predictions to detailed_results/lear_no_wsi_wind.csv
   [DETAILED] Appended to master file: detailed_results/all_predictions.csv

================================================================================
LEAR COMPLETE
================================================================================

============================= JOB FEEDBACK =============================

NodeName=uc3n082
Job ID: 2344702
Cluster: uc3
User/Group: hu_elnaab01/hu_hu
State: COMPLETED (exit code 0)
Nodes: 1
Cores per node: 64
CPU Utilized: 00:01:08
CPU Efficiency: 1.21% of 01:33:52 core-walltime
Job Wall-clock time: 00:01:28
Memory Utilized: 213.65 MB
Memory Efficiency: 0.07% of 300.00 GB (300.00 GB/node)
