/home/hu/hu_hu/hu_elnaab01/.conda/envs/bachelor_analysis/bin/python
Python 3.10.19
================================================================================
   MCD30 ONLY (WITH DETAILED TRACKING) on CUDA
================================================================================

>>> EXPERIMENT: WITH_WSI_SOLAR <<<
   [Tuning] Running 20 trials...
  0%|          | 0/20 [00:00<?, ?trial/s, best loss=?]  5%|▌         | 1/20 [00:06<02:09,  6.81s/trial, best loss: 4072.237748871547] 10%|█         | 2/20 [00:11<01:36,  5.34s/trial, best loss: 4072.237748871547] 15%|█▌        | 3/20 [00:15<01:26,  5.10s/trial, best loss: 4072.237748871547] 20%|██        | 4/20 [00:20<01:15,  4.73s/trial, best loss: 4072.237748871547] 25%|██▌       | 5/20 [00:24<01:08,  4.55s/trial, best loss: 3920.2487053783007] 30%|███       | 6/20 [00:28<01:01,  4.38s/trial, best loss: 3920.2487053783007] 35%|███▌      | 7/20 [00:32<00:56,  4.33s/trial, best loss: 3920.2487053783007] 40%|████      | 8/20 [00:37<00:53,  4.48s/trial, best loss: 3920.2487053783007] 45%|████▌     | 9/20 [00:42<00:50,  4.62s/trial, best loss: 3920.2487053783007] 50%|█████     | 10/20 [00:46<00:44,  4.50s/trial, best loss: 3920.2487053783007] 55%|█████▌    | 11/20 [00:50<00:39,  4.38s/trial, best loss: 3920.2487053783007] 60%|██████    | 12/20 [00:54<00:34,  4.34s/trial, best loss: 3920.2487053783007] 65%|██████▌   | 13/20 [00:58<00:29,  4.25s/trial, best loss: 3920.2487053783007] 70%|███████   | 14/20 [01:03<00:26,  4.48s/trial, best loss: 3920.2487053783007] 75%|███████▌  | 15/20 [01:08<00:23,  4.64s/trial, best loss: 3920.2487053783007] 80%|████████  | 16/20 [01:13<00:17,  4.50s/trial, best loss: 3920.2487053783007] 85%|████████▌ | 17/20 [01:17<00:13,  4.39s/trial, best loss: 3920.2487053783007] 90%|█████████ | 18/20 [01:22<00:09,  4.56s/trial, best loss: 3920.2487053783007] 95%|█████████▌| 19/20 [01:26<00:04,  4.47s/trial, best loss: 3920.2487053783007]100%|██████████| 20/20 [01:30<00:00,  4.38s/trial, best loss: 3920.2487053783007]100%|██████████| 20/20 [01:30<00:00,  4.53s/trial, best loss: 3920.2487053783007]
   [Training] Final Run...
   [Result] RMSE: 3919.78 | MAE: 2652.96
   [REPORT] Saved to ../outputs/results_mcd30.txt
   [DETAILED] Saved 1661 predictions to detailed_results/mcd30_with_wsi_solar.csv
   [DETAILED] Appended to master file: detailed_results/all_predictions.csv

>>> EXPERIMENT: NO_WSI_SOLAR <<<
   [Tuning] Running 20 trials...
  0%|          | 0/20 [00:00<?, ?trial/s, best loss=?]  5%|▌         | 1/20 [00:04<01:34,  4.98s/trial, best loss: 4409.218546704194] 10%|█         | 2/20 [00:09<01:29,  4.99s/trial, best loss: 4362.079601910519] 15%|█▌        | 3/20 [00:14<01:18,  4.61s/trial, best loss: 4362.079601910519] 20%|██        | 4/20 [00:18<01:15,  4.70s/trial, best loss: 4362.079601910519] 25%|██▌       | 5/20 [00:23<01:06,  4.47s/trial, best loss: 4362.079601910519] 30%|███       | 6/20 [00:27<01:04,  4.64s/trial, best loss: 4362.079601910519] 35%|███▌      | 7/20 [00:32<00:58,  4.49s/trial, best loss: 4361.232569629749] 40%|████      | 8/20 [00:37<00:55,  4.61s/trial, best loss: 3969.639774770411] 45%|████▌     | 9/20 [00:40<00:48,  4.40s/trial, best loss: 3969.639774770411] 50%|█████     | 10/20 [00:45<00:45,  4.51s/trial, best loss: 3969.639774770411] 55%|█████▌    | 11/20 [00:50<00:41,  4.57s/trial, best loss: 3969.639774770411] 60%|██████    | 12/20 [00:55<00:36,  4.61s/trial, best loss: 3969.639774770411] 65%|██████▌   | 13/20 [00:59<00:30,  4.40s/trial, best loss: 3969.639774770411] 70%|███████   | 14/20 [01:03<00:25,  4.29s/trial, best loss: 3969.639774770411] 75%|███████▌  | 15/20 [01:06<00:20,  4.15s/trial, best loss: 3969.639774770411] 80%|████████  | 16/20 [01:11<00:16,  4.13s/trial, best loss: 3959.150847927648] 85%|████████▌ | 17/20 [01:14<00:12,  4.04s/trial, best loss: 3959.150847927648] 90%|█████████ | 18/20 [01:19<00:08,  4.21s/trial, best loss: 3959.150847927648] 95%|█████████▌| 19/20 [01:23<00:04,  4.12s/trial, best loss: 3959.150847927648]100%|██████████| 20/20 [01:28<00:00,  4.30s/trial, best loss: 3959.150847927648]100%|██████████| 20/20 [01:28<00:00,  4.40s/trial, best loss: 3959.150847927648]
   [Training] Final Run...
   [Result] RMSE: 3966.76 | MAE: 3069.96
   [REPORT] Saved to ../outputs/results_mcd30.txt
   [DETAILED] Saved 1661 predictions to detailed_results/mcd30_no_wsi_solar.csv
   [DETAILED] Appended to master file: detailed_results/all_predictions.csv

>>> EXPERIMENT: WITH_WSI_WIND <<<
   [Tuning] Running 20 trials...
  0%|          | 0/20 [00:00<?, ?trial/s, best loss=?]  5%|▌         | 1/20 [00:04<01:28,  4.64s/trial, best loss: 22231.797287446934] 10%|█         | 2/20 [00:08<01:16,  4.24s/trial, best loss: 21788.28494957194]  15%|█▌        | 3/20 [00:13<01:16,  4.48s/trial, best loss: 21788.28494957194] 20%|██        | 4/20 [00:17<01:07,  4.25s/trial, best loss: 21788.28494957194] 25%|██▌       | 5/20 [00:21<01:02,  4.18s/trial, best loss: 21788.28494957194] 30%|███       | 6/20 [00:26<01:02,  4.47s/trial, best loss: 21664.795410624327] 35%|███▌      | 7/20 [00:30<00:56,  4.34s/trial, best loss: 21146.8884269791]   40%|████      | 8/20 [00:35<00:54,  4.50s/trial, best loss: 21146.8884269791] 45%|████▌     | 9/20 [00:39<00:47,  4.36s/trial, best loss: 21146.8884269791] 50%|█████     | 10/20 [00:44<00:44,  4.48s/trial, best loss: 21146.8884269791] 55%|█████▌    | 11/20 [00:48<00:39,  4.35s/trial, best loss: 21146.8884269791] 60%|██████    | 12/20 [00:52<00:34,  4.26s/trial, best loss: 21146.8884269791] 65%|██████▌   | 13/20 [00:56<00:29,  4.18s/trial, best loss: 21146.8884269791] 70%|███████   | 14/20 [01:00<00:24,  4.09s/trial, best loss: 21146.8884269791] 75%|███████▌  | 15/20 [01:04<00:21,  4.30s/trial, best loss: 21146.8884269791] 80%|████████  | 16/20 [01:09<00:17,  4.41s/trial, best loss: 21146.8884269791] 85%|████████▌ | 17/20 [01:14<00:13,  4.50s/trial, best loss: 21146.8884269791] 90%|█████████ | 18/20 [01:19<00:09,  4.61s/trial, best loss: 20911.382081622658] 95%|█████████▌| 19/20 [01:23<00:04,  4.42s/trial, best loss: 20911.382081622658]100%|██████████| 20/20 [01:27<00:00,  4.29s/trial, best loss: 20911.382081622658]100%|██████████| 20/20 [01:27<00:00,  4.35s/trial, best loss: 20911.382081622658]
   [Training] Final Run...
   [Result] RMSE: 20898.06 | MAE: 16477.52
   [REPORT] Saved to ../outputs/results_mcd30.txt
   [DETAILED] Saved 1709 predictions to detailed_results/mcd30_with_wsi_wind.csv
   [DETAILED] Appended to master file: detailed_results/all_predictions.csv

>>> EXPERIMENT: NO_WSI_WIND <<<
   [Tuning] Running 20 trials...
  0%|          | 0/20 [00:00<?, ?trial/s, best loss=?]  5%|▌         | 1/20 [00:03<01:15,  3.99s/trial, best loss: 21595.790945092973] 10%|█         | 2/20 [00:07<01:11,  3.95s/trial, best loss: 21302.082851140327] 15%|█▌        | 3/20 [00:12<01:13,  4.30s/trial, best loss: 21302.082851140327] 20%|██        | 4/20 [00:17<01:10,  4.43s/trial, best loss: 21302.082851140327] 25%|██▌       | 5/20 [00:21<01:03,  4.22s/trial, best loss: 21302.082851140327] 30%|███       | 6/20 [00:24<00:57,  4.10s/trial, best loss: 21302.082851140327] 35%|███▌      | 7/20 [00:29<00:56,  4.31s/trial, best loss: 21302.082851140327] 40%|████      | 8/20 [00:34<00:53,  4.44s/trial, best loss: 21302.082851140327] 45%|████▌     | 9/20 [00:39<00:50,  4.56s/trial, best loss: 21302.082851140327] 50%|█████     | 10/20 [00:43<00:43,  4.39s/trial, best loss: 21302.082851140327] 55%|█████▌    | 11/20 [00:48<00:40,  4.50s/trial, best loss: 21302.082851140327] 60%|██████    | 12/20 [00:52<00:35,  4.38s/trial, best loss: 21302.082851140327] 65%|██████▌   | 13/20 [00:57<00:31,  4.57s/trial, best loss: 21302.082851140327] 70%|███████   | 14/20 [01:01<00:26,  4.40s/trial, best loss: 21302.082851140327] 75%|███████▌  | 15/20 [01:05<00:22,  4.51s/trial, best loss: 21302.082851140327] 80%|████████  | 16/20 [01:09<00:17,  4.36s/trial, best loss: 21302.082851140327] 85%|████████▌ | 17/20 [01:14<00:13,  4.50s/trial, best loss: 21302.082851140327] 90%|█████████ | 18/20 [01:18<00:08,  4.38s/trial, best loss: 21302.082851140327] 95%|█████████▌| 19/20 [01:22<00:04,  4.27s/trial, best loss: 21302.082851140327]100%|██████████| 20/20 [01:26<00:00,  4.19s/trial, best loss: 21302.082851140327]100%|██████████| 20/20 [01:26<00:00,  4.34s/trial, best loss: 21302.082851140327]
   [Training] Final Run...
   [Result] RMSE: 21290.49 | MAE: 16961.39
   [REPORT] Saved to ../outputs/results_mcd30.txt
   [DETAILED] Saved 1733 predictions to detailed_results/mcd30_no_wsi_wind.csv
   [DETAILED] Appended to master file: detailed_results/all_predictions.csv

================================================================================
MCD30 COMPLETE
================================================================================

============================= JOB FEEDBACK =============================

NodeName=uc3n082
Job ID: 2344701
Cluster: uc3
User/Group: hu_elnaab01/hu_hu
State: COMPLETED (exit code 0)
Nodes: 1
Cores per node: 64
CPU Utilized: 00:06:11
CPU Efficiency: 1.46% of 07:02:24 core-walltime
Job Wall-clock time: 00:06:36
Memory Utilized: 1.13 GB
Memory Efficiency: 0.38% of 300.00 GB (300.00 GB/node)
