/home/hu/hu_hu/hu_elnaab01/.conda/envs/bachelor_analysis/bin/python
Python 3.10.19
================================================================================
   PROPHET ONLY (WITH DETAILED TRACKING)
================================================================================

>>> EXPERIMENT: WITH_WSI_SOLAR <<<
   [Tuning] Running 30 trials...
  0%|          | 0/30 [00:00<?, ?trial/s, best loss=?]  3%|▎         | 1/30 [00:00<00:28,  1.00trial/s, best loss: 6134.156467882256]  7%|▋         | 2/30 [00:02<00:29,  1.05s/trial, best loss: 2424.8471034985046] 10%|█         | 3/30 [00:03<00:29,  1.08s/trial, best loss: 2424.8471034985046] 13%|█▎        | 4/30 [00:05<00:43,  1.68s/trial, best loss: 2424.8471034985046] 17%|█▋        | 5/30 [00:06<00:36,  1.44s/trial, best loss: 2424.8471034985046] 20%|██        | 6/30 [00:07<00:29,  1.21s/trial, best loss: 2424.8471034985046] 23%|██▎       | 7/30 [00:08<00:28,  1.24s/trial, best loss: 2424.8471034985046] 27%|██▋       | 8/30 [00:09<00:25,  1.17s/trial, best loss: 2424.8471034985046] 30%|███       | 9/30 [00:10<00:22,  1.07s/trial, best loss: 2424.8471034985046] 33%|███▎      | 10/30 [00:11<00:21,  1.07s/trial, best loss: 2424.8471034985046] 37%|███▋      | 11/30 [00:14<00:28,  1.49s/trial, best loss: 2423.976816314167]  40%|████      | 12/30 [00:16<00:30,  1.68s/trial, best loss: 2423.976816314167] 43%|████▎     | 13/30 [00:17<00:25,  1.48s/trial, best loss: 2423.976816314167] 47%|████▋     | 14/30 [00:18<00:22,  1.41s/trial, best loss: 2423.976816314167] 50%|█████     | 15/30 [00:19<00:18,  1.24s/trial, best loss: 2423.976816314167] 53%|█████▎    | 16/30 [00:22<00:24,  1.75s/trial, best loss: 2423.976816314167] 57%|█████▋    | 17/30 [00:24<00:25,  1.93s/trial, best loss: 2423.976816314167] 60%|██████    | 18/30 [00:25<00:19,  1.60s/trial, best loss: 2423.976816314167] 63%|██████▎   | 19/30 [00:26<00:15,  1.37s/trial, best loss: 2423.976816314167] 67%|██████▋   | 20/30 [00:27<00:12,  1.27s/trial, best loss: 2423.976816314167] 70%|███████   | 21/30 [00:29<00:12,  1.36s/trial, best loss: 2422.9208559046415] 73%|███████▎  | 22/30 [00:30<00:11,  1.45s/trial, best loss: 2422.5933485525948] 77%|███████▋  | 23/30 [00:32<00:10,  1.49s/trial, best loss: 2422.5933485525948] 80%|████████  | 24/30 [00:34<00:09,  1.66s/trial, best loss: 2422.5933485525948] 83%|████████▎ | 25/30 [00:36<00:08,  1.78s/trial, best loss: 2422.5933485525948] 87%|████████▋ | 26/30 [00:37<00:06,  1.67s/trial, best loss: 2422.5933485525948] 90%|█████████ | 27/30 [00:39<00:05,  1.75s/trial, best loss: 2422.5933485525948] 93%|█████████▎| 28/30 [00:41<00:03,  1.61s/trial, best loss: 2422.5933485525948] 97%|█████████▋| 29/30 [00:42<00:01,  1.44s/trial, best loss: 2422.5933485525948]100%|██████████| 30/30 [00:44<00:00,  1.77s/trial, best loss: 2422.5933485525948]100%|██████████| 30/30 [00:44<00:00,  1.49s/trial, best loss: 2422.5933485525948]
   [Training] Final Run...
   [Result] RMSE: 2422.59 | MAE: 1664.02
   [REPORT] Saved to ../outputs/results_prophet.txt
   [DETAILED] Saved 1757 predictions to detailed_results/prophet_with_wsi_solar.csv
   [DETAILED] Appended to master file: detailed_results/all_predictions.csv

>>> EXPERIMENT: NO_WSI_SOLAR <<<
   [Tuning] Running 30 trials...
  0%|          | 0/30 [00:00<?, ?trial/s, best loss=?]  3%|▎         | 1/30 [00:01<00:31,  1.07s/trial, best loss: 3565.1489188607816]  7%|▋         | 2/30 [00:02<00:34,  1.23s/trial, best loss: 2478.5924814983478] 10%|█         | 3/30 [00:03<00:26,  1.03trial/s, best loss: 2478.5924814983478] 13%|█▎        | 4/30 [00:04<00:24,  1.04trial/s, best loss: 2478.5924814983478] 17%|█▋        | 5/30 [00:04<00:21,  1.15trial/s, best loss: 2478.5924814983478] 20%|██        | 6/30 [00:05<00:19,  1.23trial/s, best loss: 2478.5924814983478] 23%|██▎       | 7/30 [00:06<00:18,  1.25trial/s, best loss: 2478.5924814983478] 27%|██▋       | 8/30 [00:07<00:19,  1.10trial/s, best loss: 2478.5924814983478] 30%|███       | 9/30 [00:08<00:18,  1.11trial/s, best loss: 2457.806466714652]  33%|███▎      | 10/30 [00:09<00:18,  1.07trial/s, best loss: 2457.806466714652] 37%|███▋      | 11/30 [00:10<00:19,  1.02s/trial, best loss: 2449.364054252261] 40%|████      | 12/30 [00:11<00:18,  1.05s/trial, best loss: 2445.8950366375116] 43%|████▎     | 13/30 [00:13<00:24,  1.47s/trial, best loss: 2445.8950366375116] 47%|████▋     | 14/30 [00:14<00:20,  1.28s/trial, best loss: 2445.8950366375116] 50%|█████     | 15/30 [00:15<00:17,  1.19s/trial, best loss: 2445.8950366375116] 53%|█████▎    | 16/30 [00:16<00:15,  1.12s/trial, best loss: 2445.8950366375116] 57%|█████▋    | 17/30 [00:18<00:15,  1.18s/trial, best loss: 2445.8950366375116] 60%|██████    | 18/30 [00:20<00:19,  1.59s/trial, best loss: 2445.8950366375116] 63%|██████▎   | 19/30 [00:21<00:15,  1.37s/trial, best loss: 2445.8950366375116] 67%|██████▋   | 20/30 [00:22<00:12,  1.29s/trial, best loss: 2445.8950366375116] 70%|███████   | 21/30 [00:24<00:13,  1.46s/trial, best loss: 2445.8950366375116] 73%|███████▎  | 22/30 [00:26<00:12,  1.61s/trial, best loss: 2445.8950366375116] 77%|███████▋  | 23/30 [00:27<00:09,  1.41s/trial, best loss: 2445.8950366375116] 80%|████████  | 24/30 [00:28<00:08,  1.42s/trial, best loss: 2445.8950366375116] 83%|████████▎ | 25/30 [00:30<00:08,  1.62s/trial, best loss: 2445.8950366375116] 87%|████████▋ | 26/30 [00:31<00:05,  1.46s/trial, best loss: 2445.8950366375116] 90%|█████████ | 27/30 [00:33<00:04,  1.44s/trial, best loss: 2445.8950366375116] 93%|█████████▎| 28/30 [00:34<00:02,  1.33s/trial, best loss: 2445.8950366375116] 97%|█████████▋| 29/30 [00:35<00:01,  1.22s/trial, best loss: 2445.8950366375116]100%|██████████| 30/30 [00:37<00:00,  1.34s/trial, best loss: 2445.8950366375116]100%|██████████| 30/30 [00:37<00:00,  1.23s/trial, best loss: 2445.8950366375116]
   [Training] Final Run...
   [Result] RMSE: 2445.90 | MAE: 1696.42
   [REPORT] Saved to ../outputs/results_prophet.txt
   [DETAILED] Saved 1757 predictions to detailed_results/prophet_no_wsi_solar.csv
   [DETAILED] Appended to master file: detailed_results/all_predictions.csv

>>> EXPERIMENT: WITH_WSI_WIND <<<
   [Tuning] Running 30 trials...
  0%|          | 0/30 [00:00<?, ?trial/s, best loss=?]  3%|▎         | 1/30 [00:01<00:56,  1.96s/trial, best loss: 7121.192300765349]  7%|▋         | 2/30 [00:02<00:36,  1.31s/trial, best loss: 5260.171926030632] 10%|█         | 3/30 [00:05<00:46,  1.73s/trial, best loss: 5260.171926030632] 13%|█▎        | 4/30 [00:06<00:41,  1.60s/trial, best loss: 5260.171926030632] 17%|█▋        | 5/30 [00:07<00:32,  1.30s/trial, best loss: 5166.520063282216] 20%|██        | 6/30 [00:08<00:30,  1.28s/trial, best loss: 5166.520063282216] 23%|██▎       | 7/30 [00:10<00:34,  1.50s/trial, best loss: 5166.520063282216] 27%|██▋       | 8/30 [00:11<00:30,  1.38s/trial, best loss: 5118.806680096438] 30%|███       | 9/30 [00:12<00:27,  1.32s/trial, best loss: 5118.806680096438] 33%|███▎      | 10/30 [00:15<00:37,  1.87s/trial, best loss: 5118.806680096438] 37%|███▋      | 11/30 [00:18<00:38,  2.05s/trial, best loss: 5118.806680096438] 40%|████      | 12/30 [00:19<00:30,  1.71s/trial, best loss: 5118.806680096438] 43%|████▎     | 13/30 [00:20<00:24,  1.45s/trial, best loss: 5118.806680096438] 47%|████▋     | 14/30 [00:21<00:24,  1.55s/trial, best loss: 5118.806680096438] 50%|█████     | 15/30 [00:22<00:20,  1.37s/trial, best loss: 5118.806680096438] 53%|█████▎    | 16/30 [00:23<00:17,  1.23s/trial, best loss: 5118.806680096438] 57%|█████▋    | 17/30 [00:24<00:14,  1.10s/trial, best loss: 5113.6189144482105] 60%|██████    | 18/30 [00:25<00:12,  1.07s/trial, best loss: 5113.6189144482105] 63%|██████▎   | 19/30 [00:26<00:10,  1.03trial/s, best loss: 5055.6267379001265] 67%|██████▋   | 20/30 [00:27<00:09,  1.04trial/s, best loss: 5055.6267379001265] 70%|███████   | 21/30 [00:28<00:08,  1.03trial/s, best loss: 5055.6267379001265] 73%|███████▎  | 22/30 [00:29<00:07,  1.06trial/s, best loss: 5055.6267379001265] 77%|███████▋  | 23/30 [00:30<00:07,  1.01s/trial, best loss: 5055.6267379001265] 80%|████████  | 24/30 [00:31<00:06,  1.03s/trial, best loss: 5055.6267379001265] 83%|████████▎ | 25/30 [00:32<00:04,  1.00trial/s, best loss: 5055.6267379001265] 87%|████████▋ | 26/30 [00:33<00:04,  1.15s/trial, best loss: 5055.6267379001265] 90%|█████████ | 27/30 [00:35<00:03,  1.22s/trial, best loss: 5055.6267379001265] 93%|█████████▎| 28/30 [00:35<00:02,  1.10s/trial, best loss: 5037.077603781769]  97%|█████████▋| 29/30 [00:36<00:00,  1.01trial/s, best loss: 5037.077603781769]100%|██████████| 30/30 [00:37<00:00,  1.05trial/s, best loss: 5037.077603781769]100%|██████████| 30/30 [00:37<00:00,  1.25s/trial, best loss: 5037.077603781769]
   [Training] Final Run...
   [Result] RMSE: 5037.08 | MAE: 4067.81
   [REPORT] Saved to ../outputs/results_prophet.txt
   [DETAILED] Saved 1757 predictions to detailed_results/prophet_with_wsi_wind.csv
   [DETAILED] Appended to master file: detailed_results/all_predictions.csv

>>> EXPERIMENT: NO_WSI_WIND <<<
   [Tuning] Running 30 trials...
  0%|          | 0/30 [00:00<?, ?trial/s, best loss=?]  3%|▎         | 1/30 [00:02<00:58,  2.01s/trial, best loss: 5267.24043313482]  7%|▋         | 2/30 [00:02<00:39,  1.41s/trial, best loss: 5267.24043313482] 10%|█         | 3/30 [00:04<00:39,  1.46s/trial, best loss: 5267.24043313482] 13%|█▎        | 4/30 [00:05<00:34,  1.32s/trial, best loss: 5233.950470576475] 17%|█▋        | 5/30 [00:06<00:28,  1.14s/trial, best loss: 5233.950470576475] 20%|██        | 6/30 [00:08<00:35,  1.46s/trial, best loss: 5233.950470576475] 23%|██▎       | 7/30 [00:09<00:32,  1.43s/trial, best loss: 5233.950470576475] 27%|██▋       | 8/30 [00:10<00:26,  1.19s/trial, best loss: 5233.950470576475] 30%|███       | 9/30 [00:12<00:30,  1.43s/trial, best loss: 5233.950470576475] 33%|███▎      | 10/30 [00:14<00:32,  1.64s/trial, best loss: 5233.950470576475] 37%|███▋      | 11/30 [00:17<00:38,  2.05s/trial, best loss: 5233.950470576475] 40%|████      | 12/30 [00:18<00:30,  1.69s/trial, best loss: 5233.950470576475] 43%|████▎     | 13/30 [00:20<00:28,  1.66s/trial, best loss: 5224.615848499936] 47%|████▋     | 14/30 [00:21<00:23,  1.45s/trial, best loss: 5224.615848499936] 50%|█████     | 15/30 [00:22<00:19,  1.32s/trial, best loss: 5224.615848499936] 53%|█████▎    | 16/30 [00:22<00:16,  1.19s/trial, best loss: 5224.615848499936] 57%|█████▋    | 17/30 [00:25<00:20,  1.56s/trial, best loss: 5224.615848499936] 60%|██████    | 18/30 [00:26<00:16,  1.35s/trial, best loss: 5224.615848499936] 63%|██████▎   | 19/30 [00:27<00:13,  1.21s/trial, best loss: 5224.615848499936] 67%|██████▋   | 20/30 [00:29<00:15,  1.52s/trial, best loss: 5224.615848499936] 70%|███████   | 21/30 [00:30<00:13,  1.45s/trial, best loss: 5222.821543500929] 73%|███████▎  | 22/30 [00:31<00:10,  1.35s/trial, best loss: 5204.626812787324] 77%|███████▋  | 23/30 [00:32<00:08,  1.22s/trial, best loss: 5204.626812787324] 80%|████████  | 24/30 [00:33<00:06,  1.10s/trial, best loss: 5204.626812787324] 83%|████████▎ | 25/30 [00:34<00:05,  1.17s/trial, best loss: 5204.626812787324] 87%|████████▋ | 26/30 [00:35<00:04,  1.07s/trial, best loss: 5204.626812787324] 90%|█████████ | 27/30 [00:37<00:03,  1.19s/trial, best loss: 5204.626812787324] 93%|█████████▎| 28/30 [00:38<00:02,  1.33s/trial, best loss: 5204.626812787324] 97%|█████████▋| 29/30 [00:40<00:01,  1.30s/trial, best loss: 5204.626812787324]100%|██████████| 30/30 [00:40<00:00,  1.17s/trial, best loss: 5188.235609957911]100%|██████████| 30/30 [00:40<00:00,  1.36s/trial, best loss: 5188.235609957911]
   [Training] Final Run...
   [Result] RMSE: 5188.24 | MAE: 4188.69
   [REPORT] Saved to ../outputs/results_prophet.txt
   [DETAILED] Saved 1757 predictions to detailed_results/prophet_no_wsi_wind.csv
   [DETAILED] Appended to master file: detailed_results/all_predictions.csv

================================================================================
PROPHET COMPLETE
================================================================================

============================= JOB FEEDBACK =============================

NodeName=uc3n082
Job ID: 2344549
Cluster: uc3
User/Group: hu_elnaab01/hu_hu
State: COMPLETED (exit code 0)
Nodes: 1
Cores per node: 64
CPU Utilized: 00:02:47
CPU Efficiency: 1.35% of 03:25:52 core-walltime
Job Wall-clock time: 00:03:13
Memory Utilized: 350.88 MB
Memory Efficiency: 0.11% of 300.00 GB (300.00 GB/node)
