/home/hu/hu_hu/hu_elnaab01/.conda/envs/bachelor_analysis/bin/python
Python 3.10.19
================================================================================
   SARIMAX ONLY (WITH DETAILED TRACKING)
================================================================================

>>> EXPERIMENT: WITH_WSI_SOLAR <<<
   [Tuning] Running 30 trials...
  0%|          | 0/30 [00:00<?, ?trial/s, best loss=?]  3%|▎         | 1/30 [00:01<00:39,  1.36s/trial, best loss: 23591.875970746692]  7%|▋         | 2/30 [00:07<02:01,  4.33s/trial, best loss: 5731.377024495863]  10%|█         | 3/30 [00:09<01:20,  2.97s/trial, best loss: 5731.377024495863] 13%|█▎        | 4/30 [00:13<01:27,  3.35s/trial, best loss: 5731.377024495863] 17%|█▋        | 5/30 [00:14<01:05,  2.64s/trial, best loss: 5677.166024965513] 20%|██        | 6/30 [00:18<01:16,  3.18s/trial, best loss: 5677.166024965513] 23%|██▎       | 7/30 [00:18<00:51,  2.22s/trial, best loss: 5666.774226068528] 27%|██▋       | 8/30 [00:25<01:19,  3.62s/trial, best loss: 5666.774226068528] 30%|███       | 9/30 [00:32<01:35,  4.54s/trial, best loss: 5666.774226068528] 33%|███▎      | 10/30 [00:39<01:47,  5.38s/trial, best loss: 5666.774226068528] 37%|███▋      | 11/30 [00:41<01:21,  4.30s/trial, best loss: 5666.774226068528] 40%|████      | 12/30 [00:41<00:57,  3.17s/trial, best loss: 5653.085536369122] 43%|████▎     | 13/30 [00:42<00:39,  2.30s/trial, best loss: 5653.085536369122] 47%|████▋     | 14/30 [00:42<00:29,  1.87s/trial, best loss: 5653.085536369122] 50%|█████     | 15/30 [00:43<00:23,  1.56s/trial, best loss: 5653.085536369122] 53%|█████▎    | 16/30 [00:45<00:21,  1.50s/trial, best loss: 5653.085536369122] 57%|█████▋    | 17/30 [00:45<00:15,  1.22s/trial, best loss: 5653.085536369122] 60%|██████    | 18/30 [00:51<00:31,  2.65s/trial, best loss: 5653.085536369122] 63%|██████▎   | 19/30 [00:53<00:24,  2.27s/trial, best loss: 5653.085536369122] 67%|██████▋   | 20/30 [00:53<00:18,  1.85s/trial, best loss: 5653.085536369122] 70%|███████   | 21/30 [00:54<00:13,  1.48s/trial, best loss: 5653.085536369122] 73%|███████▎  | 22/30 [00:55<00:09,  1.22s/trial, best loss: 5653.085536369122] 77%|███████▋  | 23/30 [00:55<00:07,  1.03s/trial, best loss: 5653.085536369122] 80%|████████  | 24/30 [00:56<00:05,  1.11trial/s, best loss: 5653.085536369122] 83%|████████▎ | 25/30 [00:56<00:04,  1.22trial/s, best loss: 5653.085536369122] 87%|████████▋ | 26/30 [00:57<00:03,  1.33trial/s, best loss: 5653.085536369122] 90%|█████████ | 27/30 [00:58<00:02,  1.41trial/s, best loss: 5653.085536369122] 93%|█████████▎| 28/30 [00:58<00:01,  1.48trial/s, best loss: 5653.085536369122] 97%|█████████▋| 29/30 [00:59<00:00,  1.54trial/s, best loss: 5653.085536369122]100%|██████████| 30/30 [00:59<00:00,  1.60trial/s, best loss: 5653.085536369122]100%|██████████| 30/30 [00:59<00:00,  2.00s/trial, best loss: 5653.085536369122]
   [Training] Final Run...
   [Result] RMSE: 5653.09 | MAE: 4912.30
   [REPORT] Saved to ../outputs/results_sarimax.txt
   [DETAILED] Saved 1757 predictions to detailed_results/sarimax_with_wsi_solar.csv
   [DETAILED] Appended to master file: detailed_results/all_predictions.csv

>>> EXPERIMENT: NO_WSI_SOLAR <<<
   [Tuning] Running 30 trials...
  0%|          | 0/30 [00:00<?, ?trial/s, best loss=?]  3%|▎         | 1/30 [00:00<00:11,  2.52trial/s, best loss: 24086.486277614407]  7%|▋         | 2/30 [00:02<00:33,  1.21s/trial, best loss: 5905.042613097457]  10%|█         | 3/30 [00:03<00:31,  1.16s/trial, best loss: 5905.042613097457] 13%|█▎        | 4/30 [00:04<00:34,  1.34s/trial, best loss: 5905.042613097457] 17%|█▋        | 5/30 [00:05<00:24,  1.01trial/s, best loss: 5905.042613097457] 20%|██        | 6/30 [00:08<00:41,  1.73s/trial, best loss: 5905.042613097457] 23%|██▎       | 7/30 [00:09<00:36,  1.57s/trial, best loss: 5905.042613097457] 27%|██▋       | 8/30 [00:10<00:29,  1.34s/trial, best loss: 5905.042613097457] 30%|███       | 9/30 [00:11<00:26,  1.25s/trial, best loss: 5905.042613097457] 33%|███▎      | 10/30 [00:12<00:23,  1.19s/trial, best loss: 5905.042613097457] 37%|███▋      | 11/30 [00:18<00:49,  2.63s/trial, best loss: 5905.042613097457] 40%|████      | 12/30 [00:21<00:49,  2.74s/trial, best loss: 5905.042613097457] 43%|████▎     | 13/30 [00:22<00:39,  2.34s/trial, best loss: 5905.042613097457] 47%|████▋     | 14/30 [00:26<00:41,  2.58s/trial, best loss: 5905.042613097457] 50%|█████     | 15/30 [00:27<00:33,  2.27s/trial, best loss: 5905.042613097457] 53%|█████▎    | 16/30 [00:32<00:42,  3.04s/trial, best loss: 5905.042613097457] 57%|█████▋    | 17/30 [00:35<00:39,  3.04s/trial, best loss: 5905.042613097457] 60%|██████    | 18/30 [00:41<00:46,  3.89s/trial, best loss: 5905.042613097457] 63%|██████▎   | 19/30 [00:44<00:39,  3.60s/trial, best loss: 5905.042613097457] 67%|██████▋   | 20/30 [00:44<00:25,  2.58s/trial, best loss: 5905.042613097457] 70%|███████   | 21/30 [00:46<00:21,  2.41s/trial, best loss: 5905.042613097457] 73%|███████▎  | 22/30 [00:48<00:17,  2.22s/trial, best loss: 5905.042613097457] 77%|███████▋  | 23/30 [00:50<00:14,  2.09s/trial, best loss: 5905.042613097457] 80%|████████  | 24/30 [00:51<00:11,  2.00s/trial, best loss: 5905.042613097457] 83%|████████▎ | 25/30 [00:53<00:09,  1.93s/trial, best loss: 5905.042613097457] 87%|████████▋ | 26/30 [00:55<00:07,  1.89s/trial, best loss: 5905.042613097457] 90%|█████████ | 27/30 [00:57<00:05,  1.85s/trial, best loss: 5905.042613097457] 93%|█████████▎| 28/30 [00:58<00:03,  1.83s/trial, best loss: 5905.042613097457] 97%|█████████▋| 29/30 [01:00<00:01,  1.82s/trial, best loss: 5905.042613097457]100%|██████████| 30/30 [01:02<00:00,  1.80s/trial, best loss: 5905.042613097457]100%|██████████| 30/30 [01:02<00:00,  2.08s/trial, best loss: 5905.042613097457]
   [Training] Final Run...
   [Result] RMSE: 5905.04 | MAE: 5221.98
   [REPORT] Saved to ../outputs/results_sarimax.txt
   [DETAILED] Saved 1757 predictions to detailed_results/sarimax_no_wsi_solar.csv
   [DETAILED] Appended to master file: detailed_results/all_predictions.csv

>>> EXPERIMENT: WITH_WSI_WIND <<<
   [Tuning] Running 30 trials...
  0%|          | 0/30 [00:00<?, ?trial/s, best loss=?]  3%|▎         | 1/30 [00:01<00:31,  1.09s/trial, best loss: 5040.122241143281]  7%|▋         | 2/30 [00:02<00:34,  1.24s/trial, best loss: 5040.122241143281] 10%|█         | 3/30 [00:03<00:34,  1.29s/trial, best loss: 5012.110191896729] 13%|█▎        | 4/30 [00:05<00:35,  1.38s/trial, best loss: 5012.110191896729] 17%|█▋        | 5/30 [00:06<00:35,  1.42s/trial, best loss: 5012.110191896729] 20%|██        | 6/30 [00:07<00:27,  1.14s/trial, best loss: 5012.110191896729] 23%|██▎       | 7/30 [00:15<01:16,  3.34s/trial, best loss: 5012.110191896729] 27%|██▋       | 8/30 [00:15<00:53,  2.44s/trial, best loss: 5012.110191896729] 30%|███       | 9/30 [00:17<00:43,  2.06s/trial, best loss: 5012.110191896729] 33%|███▎      | 10/30 [00:18<00:37,  1.86s/trial, best loss: 5012.110191896729] 37%|███▋      | 11/30 [00:21<00:41,  2.19s/trial, best loss: 5012.110191896729] 40%|████      | 12/30 [00:24<00:46,  2.57s/trial, best loss: 5012.110191896729] 43%|████▎     | 13/30 [00:28<00:48,  2.85s/trial, best loss: 5012.110191896729] 47%|████▋     | 14/30 [00:29<00:39,  2.44s/trial, best loss: 5012.110191896729] 50%|█████     | 15/30 [00:30<00:30,  2.01s/trial, best loss: 5012.110191896729] 53%|█████▎    | 16/30 [00:32<00:25,  1.85s/trial, best loss: 5012.110191896729] 57%|█████▋    | 17/30 [00:33<00:22,  1.75s/trial, best loss: 5012.110191896729] 60%|██████    | 18/30 [00:40<00:40,  3.38s/trial, best loss: 5012.110191896729] 63%|██████▎   | 19/30 [00:48<00:52,  4.74s/trial, best loss: 5012.110191896729] 67%|██████▋   | 20/30 [00:49<00:33,  3.39s/trial, best loss: 5012.110191896729] 70%|███████   | 21/30 [00:50<00:25,  2.78s/trial, best loss: 5012.110191896729] 73%|███████▎  | 22/30 [00:51<00:18,  2.35s/trial, best loss: 5012.110191896729] 77%|███████▋  | 23/30 [00:53<00:14,  2.05s/trial, best loss: 5012.110191896729] 80%|████████  | 24/30 [00:54<00:11,  1.84s/trial, best loss: 5012.110191896729] 83%|████████▎ | 25/30 [00:55<00:08,  1.70s/trial, best loss: 5012.110191896729] 87%|████████▋ | 26/30 [00:57<00:06,  1.59s/trial, best loss: 5012.110191896729] 90%|█████████ | 27/30 [00:58<00:04,  1.52s/trial, best loss: 5012.110191896729] 93%|█████████▎| 28/30 [00:59<00:02,  1.47s/trial, best loss: 5012.110191896729] 97%|█████████▋| 29/30 [01:01<00:01,  1.62s/trial, best loss: 5012.110191896729]100%|██████████| 30/30 [01:02<00:00,  1.42s/trial, best loss: 5012.110191896729]100%|██████████| 30/30 [01:02<00:00,  2.10s/trial, best loss: 5012.110191896729]
   [Training] Final Run...
   [Result] RMSE: 5012.11 | MAE: 4037.50
   [REPORT] Saved to ../outputs/results_sarimax.txt
   [DETAILED] Saved 1757 predictions to detailed_results/sarimax_with_wsi_wind.csv
   [DETAILED] Appended to master file: detailed_results/all_predictions.csv

>>> EXPERIMENT: NO_WSI_WIND <<<
   [Tuning] Running 30 trials...
  0%|          | 0/30 [00:00<?, ?trial/s, best loss=?]  3%|▎         | 1/30 [00:00<00:20,  1.42trial/s, best loss: 5187.488037616281]  7%|▋         | 2/30 [00:04<01:08,  2.43s/trial, best loss: 5157.1553986548515] 10%|█         | 3/30 [00:05<00:50,  1.87s/trial, best loss: 5157.1553986548515] 13%|█▎        | 4/30 [00:06<00:41,  1.58s/trial, best loss: 5157.1553986548515] 17%|█▋        | 5/30 [00:07<00:30,  1.21s/trial, best loss: 5157.1553986548515] 20%|██        | 6/30 [00:07<00:23,  1.04trial/s, best loss: 5157.1553986548515] 23%|██▎       | 7/30 [00:08<00:23,  1.02s/trial, best loss: 5157.1553986548515] 27%|██▋       | 8/30 [00:11<00:32,  1.49s/trial, best loss: 5157.1553986548515] 30%|███       | 9/30 [00:12<00:28,  1.37s/trial, best loss: 5157.1553986548515] 33%|███▎      | 10/30 [00:13<00:26,  1.30s/trial, best loss: 5129.996006535381] 37%|███▋      | 11/30 [00:15<00:29,  1.55s/trial, best loss: 5129.996006535381] 40%|████      | 12/30 [00:16<00:25,  1.42s/trial, best loss: 5129.996006535381] 43%|████▎     | 13/30 [00:18<00:22,  1.34s/trial, best loss: 5129.996006535381] 47%|████▋     | 14/30 [00:19<00:21,  1.32s/trial, best loss: 5129.996006535381] 50%|█████     | 15/30 [00:21<00:21,  1.47s/trial, best loss: 5129.996006535381] 53%|█████▎    | 16/30 [00:22<00:19,  1.40s/trial, best loss: 5129.996006535381] 57%|█████▋    | 17/30 [00:22<00:14,  1.12s/trial, best loss: 5129.996006535381] 60%|██████    | 18/30 [00:23<00:13,  1.12s/trial, best loss: 5129.996006535381] 63%|██████▎   | 19/30 [00:26<00:15,  1.42s/trial, best loss: 5129.996006535381] 67%|██████▋   | 20/30 [00:26<00:12,  1.23s/trial, best loss: 5129.996006535381] 70%|███████   | 21/30 [00:30<00:17,  1.94s/trial, best loss: 5129.996006535381] 73%|███████▎  | 22/30 [00:34<00:19,  2.44s/trial, best loss: 5129.996006535381] 77%|███████▋  | 23/30 [00:37<00:19,  2.79s/trial, best loss: 5129.996006535381] 80%|████████  | 24/30 [00:38<00:13,  2.28s/trial, best loss: 5129.996006535381] 83%|████████▎ | 25/30 [00:42<00:13,  2.68s/trial, best loss: 5129.996006535381] 87%|████████▋ | 26/30 [00:45<00:11,  2.95s/trial, best loss: 5129.996006535381] 90%|█████████ | 27/30 [00:47<00:07,  2.61s/trial, best loss: 5129.996006535381] 93%|█████████▎| 28/30 [00:48<00:04,  2.16s/trial, best loss: 5129.996006535381] 97%|█████████▋| 29/30 [00:51<00:02,  2.26s/trial, best loss: 5129.996006535381]100%|██████████| 30/30 [00:52<00:00,  1.91s/trial, best loss: 5129.996006535381]100%|██████████| 30/30 [00:52<00:00,  1.75s/trial, best loss: 5129.996006535381]
   [Training] Final Run...
   [Result] RMSE: 5130.00 | MAE: 4136.01
   [REPORT] Saved to ../outputs/results_sarimax.txt
   [DETAILED] Saved 1757 predictions to detailed_results/sarimax_no_wsi_wind.csv
   [DETAILED] Appended to master file: detailed_results/all_predictions.csv

================================================================================
SARIMAX COMPLETE
================================================================================

============================= JOB FEEDBACK =============================

NodeName=uc3n082
Job ID: 2344554
Cluster: uc3
User/Group: hu_elnaab01/hu_hu
State: COMPLETED (exit code 0)
Nodes: 1
Cores per node: 64
CPU Utilized: 00:04:04
CPU Efficiency: 1.44% of 04:41:36 core-walltime
Job Wall-clock time: 00:04:24
Memory Utilized: 718.26 MB
Memory Efficiency: 0.23% of 300.00 GB (300.00 GB/node)
